TeamName,QuestNumber,Text,CorrectAnswers,Hint,AudioPath,ImagePath,FileRequired,QuestTimerRequired,QuestTimerDuration,HintTimerRequired,HintTimerDuration
TEAM1,44,"Излезте от къщата. \nНаправете си видео на пейката пред Славейковата къща, рамо до рамо със статуята на Пенчо Славейков. Нека в това видео всеки по оригинален начин да прочете ред/ редове от стихотворението, което Петко Славейков пише за малкия палав Пенчо. Изпратете направеното видео. \n\nМалък Пенчо \n\nПенчо бре, чети! Пенчо не чете. \nПенчо, работи! Пенчо пак не ще. \n\nПенча го мързи, гледа да лежи, \nходи, та се май, търси да играй. \n\nВреме се мина, Пенчо порасна, \nиска да яде, няма откъде.",,,,,TRUE,,,,
TEAM1,45,По улица Петко Славейков на номер 54 има дюкян за производство на цървули. Как се казва майсторът?,петър|майстор петър|петър майстор,"Имали сме цар с това име, брат на цар Асен.",,,FALSE,,,TRUE,2m
TEAM1,46,"Забележителността, до която трябва да отидете е чешма, но не каква да е, а специална чешма. Отговорът на гатанката ще ви подскаже как наричат тази чешма. \n\n""Без сладило подсладява, \nбез горчило огорчава,\n плач и радост преобръща,\n като тръгне се не връща.""\n\nЩо е то?",любовна чешма|любовна|любовната чешма|любовната,Думата е шифрована в таблицата по-горе със следния шифър: 2.3;4.6;2.1;5.3;3.1;4.3;1.1,,/static/img/chessfromletter.png,FALSE,,,TRUE,2m
TEAM1,47,"Една от най-интересните тревненски легенди разказва за най-красивата тревненска девойка и нейния възлюбен – млад резбар, който обаче не бил признат за такъв от местния еснаф. Това не му давало смелост да поиска ръката на красавицата и затова решил да се докаже, като сътвори чешма от най-сложния материал за обработване – мраморът.\nСпоред легендата, тази чешма никога не е пресъхвала, а който отпие от водата й, отпива глътка от вечната любов на двамата влюбени.\nСнимайте се как всеки отпива вода от любовната чешма. Помолете минувач да ви заснеме. ",,,,,TRUE,,,,
TEAM1,48,"С много усилия и пот, момъкът се справил със задачата и изваял красива чешма, с която запечатал ……….. Вече можел и поискал ръката й. Какъв символ на вечната любов е запечатал момъкът върху чешмата, за да поиска ръката на любимата си?",образът на девойката|образа на девойката|образ на девойка,Символът е шифрован тук: 15217182719 141 5631510111191 ,,,FALSE,,,TRUE,2m
